{"family":"provenance-record","record":{"actor_ref":"actor/alice","authority_scope_ref":"scope/project-a","derives_from":[],"expires_at":"2030-01-01T00:00:00Z","family":"provenance-record","fingerprint":"e3b0c44298fc1c149afbf4c8996fb92427ae41e4649b934ca495991b7852b855","intent_digest":"e3b0c44298fc1c149afbf4c8996fb92427ae41e4649b934ca495991b7852b855","record_digest":"515f977676a450ed3cf69fe663e592bcbb83b7fe636a9b85decac158daff7d4f","record_id":"11111111-1111-4111-8111-111111111111","revoked":false,"runtime_context_ref":"context/session-a","subject_ref":"agent-profile/1.0.0/agent-a@1","valid_from":"2026-01-01T00:00:00Z","version":"1.0.0"},"side_effects":"forbidden","version":"1.0.0"}
